{
  "event": "log.raw.ingested",
  "event_id": "0b6f5c3e-8f7a-4f53-9d7e-2c1a4b5d6e70",
  "schema_version": 1,
  "request_id": "req-0001",
  "timestamp": "2026-09-16T08:30:00.123+07:00",
  "source": "c1-ingestion",
  "domain": "shop.local",
  "data": {
    "raw": "172.18.0.1 - - [16/Sep/2026:08:30:00 +0700] \"GET /api/products?id=1%27%20OR%20%271%27=%271 HTTP/1.1\" 200 15 \"-\" \"curl/8.7.1\" \"shop.local\" rt=0.000 sid=\"demo-session-1\"",
    "log_source": "nginx",
    "log_path": "/var/log/waf/nginx/shop.local.access.log",
    "collected_at": "2026-09-16T08:30:00.120+07:00"
  }
}
